topic,content
Logistics,Ensure timely delivery by optimizing your shipping routes and reducing transit delays.
Inventory Management,Monitor stock levels regularly to avoid overstocking or shortages. Use automated systems for real-time inventory tracking.
Supplier Management,"Maintain good relationships with suppliers for better terms, and diversify suppliers to reduce risks."
Demand Forecasting,Use historical data and market trends to accurately predict future demand and adjust procurement accordingly.
Warehousing,Organize your warehouse layout efficiently to reduce picking times and improve order fulfillment speed.
Procurement,Negotiate favorable contracts with suppliers and monitor market prices to make cost-effective purchases.
Distribution,Choose the right distribution channels to ensure products reach customers quickly and efficiently.
Returns Management,Implement a streamlined returns process to handle defective or unwanted goods efficiently.
Risk Management,Identify potential risks in the supply chain and develop contingency plans to address disruptions.
Technology Adoption,"Leverage technologies like IoT, AI, and blockchain to enhance visibility and efficiency in supply chain operations."
Sustainability,Adopt eco-friendly practices such as reducing packaging waste and optimizing transportation to lower carbon emissions.
Compliance,Ensure your supply chain adheres to legal regulations and industry standards in every operational region.
Performance Metrics,"Track key performance indicators (KPIs) such as order accuracy, delivery time, and cost savings to evaluate efficiency."
Customer Satisfaction,"Focus on timely deliveries, accurate orders, and excellent post-sale support to enhance customer satisfaction."
Partnerships,"Collaborate with logistics providers, technology companies, and other partners to strengthen your supply chain network."
